School,FullAddress,Latitude,Longitude
"SCOIL NAIS IDE CAILINI, Cromcastle Green, Kilmore West","Cromcastle Green, Kilmore, Dublin, Co. Dublin, Ireland",53.3939232,-6.219731
"CASTLEJORDAN CENTRAL NS, Castlejordan, Tullamore","Castlejordan, Co. Meath, Ireland",53.3971158,-7.1213632
"SN NA MAIGHDINE MUIRE B, Shangan Road, Ballymun","Shangan Rd, Dublin, Ireland",53.3957536,-6.2621538
"VIRGIN MARY GIRLS NATIONAL SCHOOL, Shangan Road, Ballymun","Virgin Mary Girls National School, Shangan Rd, Ballymun, Dublin 9, Ireland",53.3957795,-6.2610286
"S N CILLIN LIATH, Máistir Gaoithe, Cill Airne","Killeenleagh, Mastergeehy, Co. Kerry, V23 Y540, Ireland",51.9049445,-10.0638027
"TANKERSTOWN N S, Tankerstown, Bansha","Tankerstown, Co. Tipperary, E34 AP68, Ireland",52.4192194,-8.012001
"DERRINAGREE N S, Derrinagree, Mallow","National School, Dernagree, Co. Cork, Ireland",52.1236895,-9.0358063
"ST BRIGIDS BOYS N S, Howth Road, Killester","Howth Rd, Clontarf, Dublin, Ireland",53.3747793,-6.1958623
"SCOIL NEASAIN, Baile Harmain, Baile Átha Cliath 5","McAuley Rd, Harmonstown, Dublin 5, D05 VF95, Ireland",53.3821455,-6.196239
"SCOIL NAOMH EARNAN, Lisminton, Ballintra","Unnamed Road, Lismintan, Co. Donegal, Ireland",54.5843253,-8.119533
"GLENSWILLY N S, Newmills, Letterkenny","Newmills, Rashedoge, Letterkenny, Co. Donegal, Ireland",54.9357694,-7.8493559
"SCOIL NA MAIGHDINE MHUIRE BOY, Broadford Rise, Ballinteer","Broadford Rise, Ballinteer, Dublin, Ireland",53.2753363,-6.2570937
"RATHANGAN N S, Rathangan, Duncormick","Rathangan, Millbrook, Co. Wexford, Ireland",52.2329788,-6.6162945
"ST Olaf's National School, Balally Drive, Dundrum","Balally Dr, Dundrum, Sandyford, Dublin 16, D16 E067, Ireland",53.2827824,-6.2265672
"OUR LADY OF GOOD COUNSEL BOYS N S, Johnstown, Dún Laoghaire","Kilbogget, Dublin, Co. Dun Laoghaire-Rathdown, Ireland",53.2645695,-6.1387086
"OUR LADY GOOD COUNSEL GNS, Woodley Road, Johnstown","Johnstown, Woodley Rd, Glenageary, Dublin, A96 A033, Ireland",53.2639251,-6.1389119
"KILMORE CENTRAL N S, Kilmore, Co. Cavan","Farragh, Ballinagh, Co. Cavan, H12 EE03, Ireland",53.9720761,-7.4206905
"S N BEAL ATHA GREAN, Ballyagran, Kilmallock","Ballyagran, Clonee, Co. Limerick, Ireland",52.4032339,-8.7945606
"S N TEAGHLAIGH NAOFA, SN TEAGHLAIGH NAOFA, KILLEEN","Killeen, TX, USA",31.1171194,-97.7277959
"BUTLERSBRIDGE NS, Butlersbridge, Co. Cavan","Butlers Bridge, Derrygarra Lower, Butlersbridge, Co. Cavan, Ireland",54.0452119,-7.3769588
"SCOIL CHRIOST RI B, Caherdavin, Limerick","Redgate Rd, Shannabooly, Caherdavin, Co. Limerick, V94 N229, Ireland",52.6744676,-8.6572914
"S N MUIRE NA HEIREANN, Caherdavin, Limerick","Blackthorn Dr, Shannabooly, Limerick, Ireland",52.6743701,-8.6587096
"DOOISH N S, BALLYBOFEY, CO DONEGAL","Dooish, Ballybofey, Co. Donegal, Ireland",54.8089035,-7.8443506
"SCOIL NA AINGEAL, Newtownpark AVenue, Blackrock","Newtownpark Ave, Stradbrook, Dublin, Ireland",53.2925023,-6.1714005
"SCOIL PHOIL NAOFA, Dooradoyle, Co. Limerick","Dooradoyle, Co. Limerick, Ireland",52.6372698,-8.6519717
"FLAGMOUNT CENTRAL NS, Flagmount, Caher","Flagmount, Co. Clare, Ireland",52.9863278,-8.6460702
"STRATFORD LODGE NS, BALTINGLASS, CO WICKLOW","Slaney View, Baltinglass East, Baltinglass, Co. Wicklow, Ireland",52.9421301,-6.709909
"SCOIL NAOMH EOIN BAISTE, KILBRIN, KANTURK","Kilbrin National School, Knockballymartin, Kanturk, Co. Cork, Ireland",52.2107876,-8.8333322
"S N DHUBHTHAIGH, ANAGAIRE, LEITIR CEANAINN","Illannavoree, Annagry, Co. Donegal, Ireland",55.02044,-8.3136601
"ST AIDANS N S, KILMANAGH, CO KILKENNY","Kilmangah, Kilmanagh, Co. Kilkenny, Ireland",52.6202209,-7.421903
"BALLYMACARBERRY N S, Ballymacarbry, Via Clonmel","Clogheen, Ballymacarbry, Co. Waterford, E91 E426, Ireland",52.2819265,-7.740623
"NEWCESTOWN N S, Newcestown, Bandon","Newcestown, Bandon, Co. Cork, Ireland",51.7826855,-8.8690879
"S N CHRUIMIN NAOFA, Rathyganny, Multyfarnham","Multyfarnham, Co. Westmeath, Ireland",53.6252723,-7.3893159
"S N CILL CRIODAIN, Kilcredan, Ladysbridge","Castlemartyr, Co. Cork, Ireland",51.9071474,-8.0726501
"SC NAIS REALTA NA MARA, Ballask, Kilmore","Kilmore, Ballask, Kilmore, Co. Wexford, Ireland",52.20689,-6.5457373
"ST PATRICKS NS LONGFORD, Dromard, Moyne","Dromard, Leggagh, Moyne, Co. Longford, Ireland",53.9059507,-7.6482546
"ST COLMANS N S, Cappagh, Croghan","Cappagh, Tullamore, Co. Offaly, Ireland",53.3255377,-7.3677392
"KILLENAULE N S, Killenaule, Thurles","Foulkstown, Killenaule, Co. Tipperary, Ireland",52.53818,-7.76965
"SN TIR NA CILLE, Tír na Cille, An Mam",.,.,.
"S N NAOMH AONGHUS, Bunnmayne, Bridge End","Elaghbeg, Bridge End, Co. Donegal, Ireland",55.0422391,-7.3821884
"DRUMKEERIN CENTRAL NS, Drumkeerin, Co. Leitrim","Sheena, Drumkeeran, Co. Leitrim, N41 DK12, Ireland",54.1653595,-8.1403187
"ST PATRICKS N S, Clara, Killybrone","Garrann, Garran Itra, Tyholland, Co. Monaghan, Ireland",54.262523,-6.8764093
"MULLAHORAN CENTRAL N S, Mullaghoran, Kilcogy","Glan, Callanagh Upper, Kilcogy, Co. Cavan, Ireland",53.8392853,-7.4341107
"KILLEEVAN CENTRAL N S, Newbliss, Co. Monaghan","Newbliss, Co. Monaghan, Ireland",54.1640891,-7.1416258
"ACHADH NA SILEANN, Aughnasheelin, Ballinamore","Cannaboe, Ballinamore, Co. Leitrim, Ireland",54.0522181,-7.8032043
"SCARIFF CENTRAL N S, Scariff, Co. Clare","Fossa Beg, Scarriff, Co. Clare, Ireland",52.9161783,-8.5315757
"S N NAOMH CIARAN, SCOIL NAOMH CIARAN, ROOTY CROSS OLDTOWN","Rooty Cross, Moore, Athlone, Co. Westmeath, Ireland",53.4232597,-7.9370999
"ST PAULS N S, Irishtown, Mountmellick","St Pauls Rectory, Ballycullenbeg, Mountmellick, Co. Laois, Ireland",53.1159659,-7.3263936
"S N IOGNAID, Bóithrín na Sliogán, Gaillimh","Raleigh Row, Galway, Ireland",53.2702246,-9.0626059
"Our lady's Grove Primary School, Goatstown Road,, Dublin 14","D14 Y993, Our Lady's Grove, Goatstown Rd, Friarland, Dublin 14, Ireland",53.3006942,-6.2338977
"NAOMH COLMAN MAC DUAIGH, Tierneevin, Gort","Saint Colman's National School, Tawnagh West, Gort, Co. Galway, Ireland",53.0632461,-8.8824493
"BALLYNARRY N S, Ballyheelan, Kilnaleck","Ballyheelan, Ballynarry, Co. Cavan, Ireland",53.84156,-7.34293
"St Oliver Plunkett National School, Kilkerrin, Ballinasloe","Kilkerin, Carrowleana, Kilkerrin, Co. Galway, Ireland",53.5562737,-8.5693531
"RATHMORE N S, Baltimore, Skibbereen","Baltimore Rd, Carrigfadda, Skibbereen, Co. Cork, Ireland",51.5406527,-9.2720926
"ARDFERT CENTRAL N S, Station Road, Ardfert","Station Road, Gortaspiddale, Ardfert, Co. Kerry, V92 CD63, Ireland",52.3234146,-9.7759861
"LABASHEEDA CENTRAL N S, Labasheeda, Kilrush","Labasheeda, Kilrush, Co. Clare, Ireland",52.6376305,-9.4829102
"CLONBERNE CENTRAL SCH, Clonberne, Ballinasloe","Clonberne, Kippaunagh, Ballinasloe, Co. Galway, Ireland",53.5633536,-8.6488007
"SN MUIRE GAN SMAL, Drumbaun, Curry",.,.,.
"ST MARKS SEN NS, Springfield, Tallaght","24 Maplewood Rd, Springfield, Dublin 24, Ireland",53.2873029,-6.3877017
"GARRAFRAUNS CENTRAL SCH, Dunmore, Tuam","Garrafrauns, Dunmore, Co. Galway, Ireland",53.6328231,-8.8251717
"SCOIL NAOMH AODAIN, Monasteraden, via Ballaghadereen","Kilcolman, Ballaghaderreen, Co. Roscommon, Ireland",53.9016968,-8.5792106
"MHUIRE IOSEF JUNIOR, Verbena Avenue,, Sutton","Verbena Estate, Kilbarrack Lower, Dublin, Ireland",53.3893965,-6.1466559
"ROBEEN CENTRAL N S, Robeen, Hollymount","Hollymount, Skeheen, Claremorris, Co. Mayo, Ireland",53.6810473,-9.14923
"SCOIL MOBHI, Bóthar Mobhí, Glasnaíon","St Mobhi Rd, Glasnevin, Dublin 9, D09 A303, Ireland",53.373456,-6.263202
"NA MAIGHDINE MUIRE GIRL, Ballinteer, Dublin 16","Ballinteer Ave, Ballinteer, Dublin 16, Ireland",53.2749281,-6.2579367
"SN GLEANN NA GCAORACH INÍON LÉINÍN, Wyvern, Killiney","Glenageary, Dublin, Ireland",53.2812898,-6.1238354
"S N CAITRIONA SOIS, Renmore Avenue, Renmore","idk, Renmore, Ballyloughane Strand, Co. Galway, H91 N5H6, Ireland",53.2766246,-9.0176153
"BALLYVARY CENTRAL N S, BALLYVARY CENTRAL N S, CASTLEBAR","Ballyvary, Castlebar, Co. Mayo, Ireland",53.8873554,-9.1544557
"SN MHUIRE, Main Street, Ballyhooly","Ballyhooly South, Ballyhooly, Co. Cork, P51 K284, Ireland",52.1454011,-8.3994635
"HOLY TRINITY SEN N S, Grange Road, Donaghmede","Grange Rd, Donaghmede, Dublin, Ireland",53.3964705,-6.1612406
"SCOIL BHRIDE, Green Lane, Leixlip","Green Ln, Leixlip, Co. Kildare, Ireland",53.3657764,-6.500705
"RATHCORMACK N S, Drumcliffe South, Co. Sligo","Rathcormack, Clooneen, Rathcormack, Co. Sligo, Ireland",54.3167961,-8.4790752
"S N BAILE RAIGHIN, Letterkenny, Co. Donegal","Ballyraine Rd, Ballyraine, Letterkenny, Co. Donegal, Ireland",54.9515553,-7.7125019
"SCOIL AN ATHAR TADHG, Carraig na bhFear, Co. Chorcaí","Scoil an Athar Tadgh, Main St, Carrignavar, Co. Cork, Ireland",51.9900726,-8.4778525
"ST PAULS NS COLLOONEY, The Square, Collooey","St. Paul's National School, Churchview, River View, Co. Sligo, Ireland",54.1826686,-8.4914883
"CASTLERAHAN CENTRAL NS, Castlerahan, Ballyjamesduff","Cormeen, Ballyjamesduff, Co. Cavan, Ireland",53.8209949,-7.1799383
"GOREY CENTRAL SCHOOL, Charlotte Row, Gorey","6 Charlotte Row, Gorey corporation lands, Gorey, Co. Wexford, Y25 AV99, Ireland",52.6739155,-6.2980683
"SN FHIACHNA, Kenmare Road, Glengarriff","Kenmare, Co. Kerry, Ireland",51.8801017,-9.5835203
"CLOUGHJORDAN NO 1 N S, Townfields, Cloughjordan","Templemore Rd, Townfields, Cloughjordan, Co. Tipperary, Ireland",52.9384388,-8.0297941
"ST PATRICKS NS, DRUMSHANBO, CO LEITRIM","Drumshanbo, Co. Leitrim, N41 PY61, Ireland",54.0472667,-8.0345017
"BALLYROE CENTRAL N S, ATHY, CO KILDARE","17, Church of Ireland, Snugburrow, Kilkea, Co. Kildare, Ireland",52.9617015,-6.9337661
"S N MHARCUIS B, An Gleann, Corcaigh",.,.,.
"S N BHREANNDAIN C, Glen Avenue, Cork","Glen Ave, The Glen, Cork, Ireland",51.9113151,-8.4615584
"SCOIL AN TSEACHTAR LAOCH, Bóthar Bhaile Munna, Baile Átha Cliath 11","11 Bóthar Bhaile Munna, Botanic, Baile Átha Cliath, D09 F6X3, Ireland",53.3767522,-6.2688112
"ST JOSEPHS JNR, St Joseph's Junior National School, Balbutcher Lane","Dane Rd, Ballymun, Dublin, Ireland",53.4006759,-6.2702869
"CROSSKEYS CENTRAL N S, Carrickatober, Crosskeys","Crosskeys Central National School, Carrickatober, Co. Cavan, Ireland",53.9196272,-7.2643814
"LATTON, LATTON, CASTLEBLAYNEY","Lisdrumcleve, Latton, Co. Monaghan, Ireland",54.0705565,-6.946578
"ST FRANCIS XAVIER J N S, Roselawn Road, Castleknock","Roselawn Glade, Blanchardstown, Dublin 15, D15 F5PN, Ireland",53.3839319,-6.3837962
"SN NAOMH MHICHIL, Dungeagáin, Baile 'n Sceilg","Dungeagan, Ballinskelligs, Co. Kerry, Ireland",51.8244027,-10.2730136
"SCOIL NAITHI, Bóthar Átha Leathan, Baile an tSaoir","Stone Mason's Way, Ballinteer, Dublin 16, Ireland",53.282284,-6.2612611
"SCOIL COLMCILLE SENIOR, Coolevin, Ballybrack","Ballybrack, Dublin, Ireland",53.2547263,-6.1345338
"RUAN CENTRAL NS, Dromore, Ruan","Ruan National School, Dromore, Ennis, Co. Clare, Ireland",52.933727,-8.9886814
"CLONEA NS, Clonea-Power, Carrick-on-Suir","Carrick-On-Suir, Townparks, Carrick On Suir, Co. Tipperary, Ireland",52.3476495,-7.4189708
"SCOIL MHUIRE BOYS, Grange Road, Rathfarnham","14 Grange Rd, Rathfarnham, Dublin 14, Ireland",53.294806,-6.283881
"S N REALT NA MARA, TUATH O SIOSTA, CILL AIRNE","Tuosist, Ardea, Killarney, Co. Kerry, Ireland",51.8065507,-9.7503632
"ST OLIVER PLUNKETTS NS, Newcastle, Athenry","Newcastle National School, Newcastle, Athenry, Co. Galway, Ireland",53.3430319,-8.6836769
"NEWPORT CENTRAL, BAILE UI BHFIACHAIN, CO MHAIGH EO","Newport, Co. Mayo, Ireland",53.8852758,-9.5463685
"SCOIL MHUIRE, Ballymany, Newbridge","Standhouse Rd, Moorfield, Newbridge, Co. Kildare, Ireland",53.1732978,-6.8169014
"DARNDALE NS JUNIOR, OUR LADY IMMAC JUN NS, DARNDALE","Priorswood, Darndale, Co. Dublin, Ireland",53.3983085,-6.1923102
"ST CRONANS JUNIOR NATIONAL SCHOOL, Brackenstown, Swords","Brackenstown Rd, Windmill Lands, Swords, Co. Dublin, Ireland",53.4589186,-6.2366444
"KILGARVAN CENTRAL SCHL, Kilgarvan, Co. Kerry","Dromnycolman, Kilgarvan, Co. Kerry, Ireland",51.9031476,-9.4384061
"Scoil Mhuire, Green Lane, Leixlip","Green Ln, Leixlip, Co. Kildare, Ireland",53.3657391,-6.5009022
"EILTIN NAOFA, LIOS EILTIN, CO. CHIARRAI","Lisselton National School, Loughanes, Lisselton, Co. Kerry, V31 Y266, Ireland",52.4878,-9.5780656
"SCOIL MAELRUAIN JUNIOR, Old Bawn, Tallaght","Old Bawn, Tallaght, Dublin, Ireland",53.2777476,-6.3633424
"SCOIL MAELRUAIN SENIOR, Old Bawn, Tallaght","Old Bawn, Tallaght, Dublin, Ireland",53.2777476,-6.3633424
"ST KEVINS BOYS, Kilnamanagh, Tallaght","Treepark Rd, Kilnamanagh, Dublin 24, D24 A2XF, Ireland",53.3005905,-6.3576332
"ST KEVINS GIRLS, Kilnamanagh, Tallaght","Treepark Dr, Tymon North, Dublin, Co. Dublin, 24, Ireland",53.3000387,-6.357347
"SAINT MELS, Ardagh Village, Co. Longford","No 1, Lyanmore, Ardagh Village, Co. Longford, N39 CD85, Ireland",53.6661354,-7.6940361
"SN CAITRIONA SINSEAR, Renmore Avenue, Renmore","idk, Renmore, Ballyloughane Strand, Co. Galway, H91 N5H6, Ireland",53.2766246,-9.0176153
"NAOMH OLIVER PLUNKETT, Tossey, Loughmourne","Lough Morne, Tossy, Castleblayney, Co. Monaghan, Ireland",54.0782547,-6.8444152
"ST FRANCIS XAVIER SENIOR N S, Roselawn, Castleknock","Roselawn Rd, Blanchardstown, Dublin 15, Ireland",53.3828904,-6.3834728
"ST PAULS JUNIOR NATIONAL SCHOOL, Clonrosse Drive, Ard na Gréine","Saint Paul's Jr National School, Clonrosse Dr, Ard Na Gréine, Dublin 13, Ireland",53.3949641,-6.1836254
"ST MARKS JUNIOR MIXED, Springfield, Tallaght","Springfield, Whitestown, Dublin 24, Ireland",53.2871777,-6.3872679
"SCOIL BHRIDE, Grange Road, Donaghmede","Grange Rd, Donaghmede, Dublin, Ireland",53.3971252,-6.1610999
"SCOIL COLMCILLE NAOFA, Idrone Avenue, Knocklyon","Idrone Ave, Knocklyon, Dublin 16, Ireland",53.2838476,-6.3165684
"ST BRIGIDS NS, Singland, Limerick","Singland, Limerick, Ireland",52.6567723,-8.5984646
"ST OLIVER PLUNKETT NS, Blackcastle, Navan","Blackcastle, Navan, Co. Meath, Ireland",53.6626935,-6.6780326
"HOLY FAMILY B N S, Askea, Carlow","Carlow, Co. Carlow, Ireland",52.8363549,-6.9130105
"Holy Family Girls N S, Askea, Co. Carlow","Carlow, R93 X793, Ireland",52.83561,-6.9127226
"RATHMULLAN N S, Marley's Lane, Drogheda","Marley's Ln, Rathmullan, Drogheda, Co. Louth, Ireland",53.7111062,-6.3717387
"ST PATRICKS, St Patrick's Close, Dublin 8","8 St Patrick's Close, Dún Laoghaire, Dublin, A96 P599, Ireland",53.285366,-6.1506512
"S N DAR EARCA, Ballyhearny, Valentia","Valentia Island, Co. Kerry, Ireland",51.9107738,-10.3548996
"SCOIL NAIS DEAGLAIN, Ashbourne, Co. Meath","Bourne Ave, Killegland, Ashbourne, Co. Meath, A84 KT02, Ireland",53.5058196,-6.4006982
"HOLY CROSS PRIMARY SCHOOL, New Road, Killarney","New Rd, Kilcoolaght, Killarney, Co. Kerry, Ireland",52.0627035,-9.5139102
"SCOIL NAOMH FEICHIN, Kilgellia, Attymass","Newtown, Termonfeckin, Co. Louth, A92 YN15, Ireland",53.7581725,-6.2712171
"SN NAOMH FINNIN, Glenties Park, Rivermount","Glenties Park, Finglas South, Rivermount, Co. Dublin, Ireland",53.3805504,-6.3120669
"SCOIL MHUIRE, Glenmore Court, Ballyboden","Glenmore Ct, Rathfarnham, Dublin 16, Ireland",53.2793738,-6.2892052
"SCOIL MHUIRE, Ramelton, Co. Donegal","Scoil Mhuire National School, Back Rd, Rathmelton, Co. Donegal, Ireland",55.0337173,-7.6494744
"SN OILIBHEAR NAOFA, Ballylongford, Co. Kerry","Rusheenpark, Ballylongford, Co. Kerry, Ireland",52.5479992,-9.4788097
"BISHOP GALVIN NS, Orwell Park, Templeogue","Orwell Park, Templeogue, Dublin 6W, Co. Dublin, Ireland",53.298067,-6.3186092
"CARBURY NAT SCH, The Mall, Sligo","The Mall, Rathquarter, Sligo, Ireland",54.2722253,-8.4659521
"SCOIL FHIACHRA SOISIR, Montrose Park, Artane","Montrose Park, Beaumont, Dublin 5, Ireland",53.3877761,-6.2263069
"SCOIL MHUIRE, Rathsallagh, Shankill","Shanganagh Gardens, Rathsallagh Dr, Rathsallagh, Shankill, Co. Dublin, Ireland",53.236525,-6.122336
"CAHERMORE NEW CENTRAL S, Cahermore, Allihies","Cahermore National School, Killough East, Bantry, Co. Cork, Ireland",51.6057552,-10.0617709
"SCOIL AENGHUSA JUN NS, Balrothery, Tallaght","Castletymon Road, Balrothery, Dublin, D24 YN34, Ireland",53.2930724,-6.3450579
"SCOIL CHRONAIN, An tSráid Mhór, Ráth Cúil","Main St, Rathcoole, Co. Dublin, D24 YW81, Ireland",53.2817031,-6.4674522
"SN OILIBHEIR, An Chúil Mhín, Cluain Saileach","15 Coolmine Cl, Clonsilla, Blanchardstown, Dublin, D15 PRX8, Ireland",53.3821828,-6.3942989
"CAPPATAGLE CENTRAL SCH, Cappataggle, Ballinasloe","Cappataggle, Co. Galway, Ireland",53.2695268,-8.4095584
"SCOIL CHAITIGHEIRN, Eyeries, Bantry","Eyeries, Co. Cork, Ireland",51.6951916,-9.9636184
"SCOIL NANO NAGLE, Bawnogue Road, Clondalkin","Scoil Nano Nagle, Bawnogue Rd, Clonburris Great, Dublin 22, Ireland",53.3261708,-6.4134097
"TALBOT SENIOR NS, Bawnoge, Clondalkin","Bawnogue, 22, Lealand Rd, Clonburris Great, Dublin, Ireland",53.3262094,-6.413885
"ST SAVIOURS NS, Ballybeg Drive, Waterford","Ballybeg, Waterford, Ireland",52.2399313,-7.145691
"ST OLIVERS NS, Ballycasheen, Killarney","Ballycasheen, Killarney, Co. Kerry, Ireland",52.0554059,-9.4929023
"SN NAOMH TREASA, Hampton, Balbriggan","Dublin St, Hampton Demesne, Balbriggan, Co. Dublin, Ireland",53.6039405,-6.173211
"S N NAOMH BAOITHIN, St Johnston, Lifford","Lifford, Co. Donegal, Ireland",54.8328751,-7.485639
"ST BRIDS, Drumcong, Carrick-on-Shannon","St Brigids, Drumcong, Co. Leitrim, Ireland",54.030275,-7.9745255
"OUR LADY IMMAC SEN N S, OUR LADY IMMAC SEN NS, DARNDALE","Priorswood, Darndale, Co. Dublin, Ireland",53.3983085,-6.1923102
"MHICHIL NAOFA, Derrycreeveen, Bere Island","Ballinakilla, Bere Island, Ballynakilla, Bantry, Co. Cork, Ireland",51.6353948,-9.8827582
"SN CILL DAIRBHRE, FERMOY ROAD, KILDORRERY","Kildorrery, Co. Cork, Ireland",52.2451159,-8.4261512
"CABRA CENTRAL N S, Cabra, Kingscourt","Cabra Central School, Drumpeak, Kingscourt, Co. Cavan, Ireland",53.9205217,-6.8116236
"RAMSGRANGE CENTRAL N S, Ramsgrange, Co. Wexford","Ramsgrange, Co. Wexford, Ireland",52.2457011,-6.9201274
"SCOIL MHUIRE, Maigh Cuilinn, Co. na Gaillimhe","Church Rd, Ballycuirke West, Moycullen, Co. Galway, Ireland",53.339705,-9.1762813
"S N MUIRE AGUS IOSEF, Verbena Ave, Bayside","Verbena Ave, Kilbarrack Lower, Dublin, Ireland",53.3891476,-6.1466574
"BALLYBAY NATIONAL SCHOOL, Kiltoom, Athlone","Ballybay Kiltoom, Cornaseer, Athlone, Co. Roscommon, N37 RC82, Ireland",53.4646012,-8.0077001
"BRACKENSTOWN SENIOR N S, Brackenstown Road, Swords","26 27 Brackenstown Village, Windmill Lands, Swords, Co. Dublin, K67 R2V8, Ireland",53.4587988,-6.2355043
"HOLY FAMILY, Balloonagh, Tralee","Holy Family School, Balloonagh, Tralee, Co. Kerry, V92 R239, Ireland",52.2712878,-9.712518
"ST ATTRACTAS JUNIOR N S, Meadowbrook, Dundrum","Broadford Rd, Ballinteer, Dublin, Ireland",53.2809355,-6.2563495
"ST KEVINS JUNIOR N S, Newbrook Avenue, Donaghmede","Newbrook Rd, Donaghmede, Dublin 13, Ireland",53.3965746,-6.1579867
"CLOGHEEN CENTRAL N S, CLOGHEEN, CO TIPPERARY","Curraghslagh, Co. Tipperary, E21 F651, Ireland",52.270425,-7.990154
"BELGARD HEIGHTS N S, Cookstown Road, Tallaght","Belgard Heights, Tallaght, Cookstown, Dublin, Ireland",53.2976648,-6.3858723
"ST THOMAS JUNIOR NATIONAL SCHOOL, Newcastle Road, Lucan","Glebe, Esker, Lucan, Co. Dublin, Ireland",53.3492409,-6.4487082
"SCOIL N AN CROI RO NAOFA, Killinarden, Tallaght","28 R113, Whitestown, Dublin, Ireland",53.2773716,-6.3818283
"KILCHREEST CENTRAL SCH, Lackabaun, Kilchreest","Kilchreest Church, Ballingarry, Loughrea, Co. Galway, Ireland",53.1744578,-8.6484392
"CORDUFF N S, Blackcourt Road, Corduff","Corduff, Blanchardstown, Corduff, Dublin 15, Ireland",53.3987251,-6.3764187
"ST OLIVER PLUNKETT N S, St Helena's Drive, Finglas","St Helena's Rd, Finglas South, Dublin, Ireland",53.3817677,-6.2998267
"ST FINTANS NS, Carrickbrack Road, Sutton","Carrickbrack Rd, Sutton North, Dublin 13, Ireland",53.3805458,-6.0953722
"BALLYMANY JUNIOR NS, Standhouse Rd., Newbridge","Standhouse Rd, Moorfield, Newbridge, Co. Kildare, Ireland",53.173346,-6.8167029
"INCHICRONAN CENTRAL NS, Clonmooney, Crusheen","Crusheen, Co. Clare, Ireland",52.9386532,-8.8967688
"NAOMH TOLA, Tullyglass, Shannon","Tullyglass, Shannon, Co. Clare, Ireland",52.703702,-8.8861837
"SCOIL MHUIRE, BORNACOOLA, CARRICK ON SHANNON","Dublin Rd, Townparks, Carrick-On-Shannon, Co. Leitrim, Ireland",53.9457051,-8.0890674
"ST KILIANS JUNIOR SCHOOL, Kingswood Heights, Castleview","Castleview, Kingswood Heights, Dublin 24, Ireland",53.3069222,-6.3694685
"CAHERAGH NS, Caheragh, Drimoleague","Caheragh, Drimoleague, Co. Cork, Ireland",51.6259274,-9.2998018
"CHRIOST RI, Cloughleigh, Ennis","Cloughleigh, Ennis, Co. Clare, Ireland",52.8471987,-8.9917103
"SCOIL TREASA FIRHOUSE, Ballycullen Avenue, Firhouse","Ballycullen Ave, Tymon South, Dublin 24, Ireland",53.2808367,-6.3389609
"OUR LADY QUEEN OF APOSTLES, Dunawley Avenue, Clondalkin","Clonburris National School, Dunawley Avenue, Clondalkin, Dublin 22, Ireland",53.3265712,-6.4012646
"ST PATRICKS, Bruskey, Ballinagh","Bruskey, Brusky, Ballinagh, Co. Cavan, Ireland",53.886216,-7.4071031
"NEILLSTOWN N S, Neillstown Road, Clondalkin","Neilstown Rd, Collinstown, Dublin 22, Ireland",53.337548,-6.3993782
"ST LAURENCES N S, Kindlestown, Greystones","Chapel Rd, Kindlestown Lower, Delgany, Co. Wicklow, Ireland",53.1411806,-6.0855486
"MARLEY GRANGE NS, Grange Manor Close, Marley Grange","16 Grange Manor Cl, Rathfarnham, Dublin 16, D16 XC98, Ireland",53.2841086,-6.273189
"ST MARYS JUNIOR N S, Rowlagh, Clondalkin","Liscarne Cl, Rowlagh, Clondalkin, Co. Dublin, Ireland",53.343366,-6.3951148
"S N AENGHUSA, SCOIL N AENGHUSA SIN, BALROTHERY","Tallaght, Balrothery, Dublin, Ireland",53.293154,-6.3451762
"SCOIL IOSA, Tymon Road, Tallaght","Tymon N Rd, Tallaght, Dublin 24, Ireland",53.2990111,-6.3472017
"ST HELENS JUNIOR N S, Martello, Portmarnock","Saint Helens Jr School, Limetree Ave, Robswalls, Portmarnock, Co. Dublin, Ireland",53.4389951,-6.1358037
"ST MAELRUAINS N S, Kilclare Avenue, Jobstown","Kilclare Ave, Jobstown, Dublin 24, Ireland",53.2824973,-6.392134
"ST JOSEPHS SENIOR N S, Balcurris Road, Ballymun","Balcurris Rd, Ballymun, Dublin 11, Ireland",53.4022405,-6.2719014
"SCOIL CHUALANN, Bóthar Vevay, Bré","Putland Rd, Newcourt, Bray, Co. Wicklow, A98 VP93, Ireland",53.1950437,-6.0996349
"GAELSCOIL INSE CHOR, Droichead ns hInse, Baile Átha Cliath 8","Gaelscoil Inse Chór, S Circular Rd, Kilmainham, Dublin 8, Ireland",53.3440417,-6.3118291
"ST MARYS CENTRAL SCHOOL, ENNISKEANE, CO CORK","Derrigra, Ballineen and Enniskean, Co. Cork, Ireland",51.735556,-8.948611
"CROSSERLOUGH N S, Crosserlough, Co. Cavan","Crosserlough, Co. Cavan, Ireland",53.8647112,-7.2884148
"AN LINBH IOSA, Ballycane, Naas","Lacken View, Tipper West, Naas, Co. Kildare, Ireland",53.2125285,-6.6539987
"MUIRE NA NGAEL NS, Bay Estate, Dundalik","Marsh South, Bay Estate, Dundalk, Co. Louth, Ireland",53.995292,-6.3739257
"S N NAOMH MHUIRE, Drumlea, Carrigallen","Scoil Naomh Mhuire, Drumlea, Carrigallen, Co. Leitrim, Ireland",54.0183703,-7.7287208
"ST PHILIP THE APOSTLE JUNIOR N S, Mountview, Clonsilla","Mountview Rd, Clonsilla, Dublin 15, Ireland",53.3908499,-6.4080154
"SCOIL MHUIRE, Ballinamona, Campile","Horeswood, Campile, Co. Wexford, Ireland",52.3100082,-6.957684
"SCOIL NAIS MHUIRE SOIS, Blakestown, Mulhuddart","15 Blakestown Rd, Blakestown, Mulhuddart, Co. Dublin, D15 YR6P, Ireland",53.4004254,-6.4002702
"KILPATRICK NS, KILPATRICK, MULLINGAR","Kilpatrick, Mullingar, Co. Westmeath, Ireland",53.511839,-7.3971569
"ST KILLIANS N S, Mullagh, Co. Cavan","Mullagh, Glebe, Mullagh, Co. Cavan, Ireland",53.8136431,-6.9599207
"SCOIL NAOMH COLMCILLE, Newbrook Road, Donaghmede","13 Newbrook Rd, Donaghmede, Dublin, D13 A9X0, Ireland",53.3954237,-6.1600112
"DALKEY SCHOOL PROJECT, GLENAGEARY LODGE, GLENAGEARY","Glenageary Lodge, Dún Laoghaire, Dublin, Ireland",53.2747071,-6.1330771
"SCOIL CNOC MHUIRE SIN, Knockmore Avenue, Tallaght","Knockmore Ave, Killinardan, Dublin, Ireland",53.2755931,-6.3919739
"NAOMH BODAIN, Culdaff, Lifford","Culdaff, Co. Donegal, Ireland",55.2859437,-7.1651352
"SCOIL MHUIRE, Michael J Prendergast Road, Tallow","Tallow, Co. Waterford, Ireland",52.0921407,-8.0070302
"ST MARTIN DE PORRES N S, Heatherview Lawn, Aylesbury","Heatherview Lawn, Oldbawn, Dublin 24, D24 HF54, Ireland",53.2750624,-6.3713273
"ST PAULS SEN NS, AYRFIELD, MALAHIDE RD","Saint Paul's Senior National School, Clonrosse Dr, Ard Na Gréine, Dublin 13, Ireland",53.3952284,-6.1836657
"ST MALACHYS NS, St. Helena's Road, FINGLAS","St Helena's Rd, Finglas South, Dublin, Ireland",53.3822401,-6.2991356
"SCOIL NAIS CAITRIONA, The Avenue, Rush",.,.,.
"Scoil Réalt na Mara, Balbriggan Road, Skerries","Balbriggan Rd, Townparks, Skerries, Co. Dublin, Ireland",53.5804552,-6.1208975
"ST CANICES CENTRAL N S, Granges Road, Kilkenny","Granges Rd, Bishopsmeadows, Kilkenny, Ireland",52.6600889,-7.2619344
"JOHN PAUL II N S, Sea Road, Malahide","Inbhir Ide Dr, Yellow Walls, Malahide, Co. Dublin, Ireland",53.4542027,-6.1692893
"ST FIACHRAS SEN N S, St. Fiachras SNS, Montrose Park","Montrose Park, Beaumont, Dublin 5, Ireland",53.3877761,-6.2263069
"HOLY CROSS SCHOOL, Ballycarnane, Tramore","Ballycarnane, Tramore, Co. Waterford, Ireland",52.1602194,-7.1656797
"GAELSCOIL MHIC EASMAINN, Ráth Rónáin, Trá Lí","Ráth Rónáin, Trá Lí, Co. Kerry, Ireland",52.2835323,-9.6931303
"BALLINAHOWEN NS, ATHLONE, CO WESTMEATH","Ballynahown, Athlone, Co. Westmeath, Ireland",53.3493778,-7.8504503
"MOYLE N S, Moyle National School, Newtowncunningham","Moyle, Newtowncunningham, Co. Donegal, Ireland",54.998847,-7.5316515
"RANSBORO NEW CENTRAL, Ransboro, Knocknahur","Knocknahur, Knocknahur North, Knocknahur, Co. Sligo, Ireland",54.2446217,-8.5399534
"ST PATRICKS SENIOR SCHOOL, CORDUFF, BLANCHARDSTOWN","Blackcourt Road, Blanchardstown, Dublin 15, Ireland",53.3989538,-6.3769441
