School,FullAddress,Latitude,Longitude
"ST PATRICKS NS, Broomfield, Castleblayney","Broomfield, Clonavogy, Castleblayney, Co. Monaghan, Ireland",54.0895081,-6.7236738
"OUR LADY QUEEN OF PEACE SCHOOL, Janesboro, Limerick","Our Lady Queen of Peace Primary School, O'Donoghue Ave, Janesboro, Limerick, Ireland",52.6489643,-8.6220221
"SCOIL TOBAR PADRAIG, Patrickswell, Co. Limerick","Barnakyle, Patrickswell, Co. Limerick, Ireland",52.5982214,-8.7068627
"SCOIL NAIS AITINN BHUI, Beauparc, Navan","Seneschalstown, Beauparc, Co. Meath, Ireland",53.6714887,-6.5703569
"SCOIL NAIS MHUIRE NAOFA, KILTALE, DUNSANY","Kiltale, Marshalstown, Co. Meath, Ireland",53.5312935,-6.6669133
"NAOMH MUIRE N S, Finea, Mullingar","Finnea, Co. Westmeath, Ireland",53.7799558,-7.3884514
"S N GNIOMH GO LEITH B, RATHMORE, CO KERRY","Rath More, Gneevgullia, Co. Kerry, Ireland",52.1190844,-9.2731841
"SCOIL COLMAIN NAOFA, Mucklagh, Tullamore","Mucklagh, Co. Offaly, Ireland",53.2530643,-7.5418461
"S N NA SRONA, Rathmore, Co. Kerry","Shrone Beg, Co. Kerry, Ireland",52.0453154,-9.2621596
"S N PADRAIG NAOFA, Dúngar (Frenchpark), An Caisleáin Riabhach","Corskeagh, Frenchpark, Co. Roscommon, Ireland",53.8695107,-8.4074281
"S N CHIARAIN NAOFA, Broughall, Kilcormac","Broughal Rd, Broughal, Kilcormac, Co. Offaly, Ireland",53.1905641,-7.7737986
"S N NAOMH EOIN B, Station Road, Ballincollig","Ballincollig, Co. Cork, Ireland",51.8863443,-8.5905383
"SCOIL NAOMH MHUIRE C, Ballincollig, Co. Cork","139 Pine Walk, Ballincollig, Co. Cork, P31 N265, Ireland",51.886554,-8.5929551
"BALLINABRANNA MXD N S, Milford, Co. Carlow","Ballinabranna, Milford, Co. Carlow, R93 T9N4, Ireland",52.7855788,-6.9827055
"SCOIL MHICHIL NAOFA, CROSSPATRICK, CO KILKENNY (VIA THURLES)","Moneynamuck (Stopford), Galmoy, Co. Kilkenny, Ireland",52.7921787,-7.5712127
"S N BRIGHDE, Mionlach, An Caisleán Gearr","Menlough, Co. Galway, Ireland",53.421329,-8.5747566
"S N BAILE AN LEASA, DUNMORE, TUAM","Tuam, Co. Galway, Ireland",53.5141156,-8.8565177
"S N MHUIRE, Billeragh, Araglin","Gortnaskehy, Araglin, Co. Cork, Ireland",52.2071513,-8.1066188
"ROCKCHAPEL N S, Lyraneag, Rockchapel","Lyraneag, Co. Cork, Ireland",52.2897625,-9.1411452
"S N RE NA SCRINE, Maulyregan, Rosscarbery","Maulyregan, Co. Cork, Ireland",51.6315892,-9.058046
"Scoil Ghormáin Naofa, Castletown, Inch","Clones Upper, Castletown, Co. Wexford, Ireland",52.7194178,-6.1833705
"S N MHUIRE, Grahormack, Tagoat","Grahormack, Tagoat, Co. Wexford, Ireland",52.2454387,-6.3883001
"S N NAOMH COLMAIN, Scoil Cholmain, Muigh-Inis","Mosestown, Whitegate, Co. Cork, Ireland",51.8234779,-8.2355132
"S N MHUIRE, Lisheenkyle, Oranmore","Scoil Mhuire, Castle Rd, Oran More, Oranmore, Co. Galway, Ireland",53.2673363,-8.9318252
"S N BRIGHDHE NAOFA, CINN MARA, CO NA GAILLIMHE","Galway, Ireland",53.270668,-9.0567905
"S N LISSARA NAOFA, Ballinacarrow, Ballymote","Ballynacarrow, Ballynacarrow South, Ballinacarrow South, Co. Sligo, Ireland",54.1334613,-8.5627198
"S N COMHGHALL, Drumsloe, Drummully",.,.,.
"POWERSTOWN N S, Clonmel, Co. Tipperary","Powerstown National School, Rathloose, Clonmel, Co. Tipperary, Ireland",52.3719862,-7.6636878
"BALLYHAISE N S, Cavan Road, Ballyhaise","Ballyhaise, Raheg, Ballyhaise, Co. Cavan, Ireland",54.0473393,-7.3155094
"S N BRIDE NAOFA, Shantalla Road, Galway","Shantalla Rd, Galway, Ireland",53.273504,-9.071456
"S N CHUIRT DOIGHTE, Burncourt, Cahir","Burncourt, Cahir, Co. Tipperary, E21 PT44, Ireland",52.3120761,-8.0780481
"S N PADRAIC NAOFA, Lombard Street, Galway","Lombard St, Galway, Ireland",53.272552,-9.0544456
"SAN NIOCLAS MYRA, Malahide Road, Kinsealy","17 Malahide Rd, Beaumont, Dublin, D05 H9F9, Ireland",53.3854658,-6.2030034
"S N COLMCILL NAOFA, MOONE, ATHY","Moone, Simonstown West, Athy, Co. Kildare, Ireland",52.9732903,-6.8165606
"S N CILL TARTAIN, GORT INSE GUAIRE, CO NA GAILLIMHE","Gort, Co. Galway, Ireland",53.0666432,-8.8187485
"CURRAGHAGALLA N S, Curraghagalla, Kilworth","Curraghagalla National School, Knockanenabohilly, Kilworth, Co. Cork, Ireland",52.207305,-8.2929551
"S N PADRAIG NAOFA, CLOIDEACH, ATH CINN","Headford, Co. Galway, Ireland",53.4694617,-9.106134
"S N AN PHAIRC, YOUGHAL, CO CORK","Youghal, Co. Cork, Ireland",51.9542704,-7.8471707
"Our Lady's National School, Nurney, Carlow","Nurney, Co. Carlow, Ireland",52.7487876,-6.9120872
"S N NA HAILLE, AILL,, AN MHOIN ARD",.,.,.
"S N SEOSAMH NFA, BREE, ENNISCORTY","Enniscorthy, Co. Wexford, Ireland",52.5068183,-6.5819746
"S N CNOC NA MANACH, Knocknamanagh, Minane Bridge","Minane Bridge, Minane, Cork, Ireland",51.7629651,-8.376799
"CILL CLEITHE N S, Kilcleagh, Castledaly","Castledaly, Moate, Co. Westmeath, Ireland",53.3742722,-7.8080253
"S N CATHAIR GEAL, Cahergal, Tuam","Cahergal, Co. Galway, Ireland",53.4679013,-8.7841335
"ST MARY'S PRIMARY, Lisroyne, Strokestown","Saint Mary's Primary School, Lisroyne, Strokestown, Co. Roscommon, Ireland",53.776898,-8.1123393
"SN NICOLAIS NAOFA, DUNLUAIN, CO CILL MHANTAIN","Wicklow, Co. Wicklow, Ireland",52.9862313,-6.3672543
"ST MARYS N S, Parnell Avenue, Enniscorthy","16 Parnell Ave, Enniscorthy, Co. Wexford, Y21 FX21, Ireland",52.4977836,-6.5720239
"GEAROID UI GHRIOBHTHA, LOUGHILL, County Limerick","Loghill, Co. Limerick, Ireland",52.5954605,-9.1925703
"COORACLARE B N S, Cooraclare, Kilrush","Drimna, Kilrush, Co. Clare, Ireland",52.6406999,-9.4859374
"BRIGHDE NAOFA, Rowlestown Drive, Kilsallaghan","Rolestown East, Rolestown, Co. Dublin, Ireland",53.4902647,-6.2990086
"ST. MARY'S PRIMARY SCHOOL, Johnstown Road, Enfield","650 Armstrong St, St Marys, OH 45885, USA",40.5518323,-84.3810636
"SCOIL BHRIGHDE, Mín an Chladaigh, Gort a Choirce","N56, Madavagh, Co. Donegal, Ireland",54.8572029,-8.3031649
"GLANTANE B N S, Brittas, Lombardstown","Brittas, Lombardstown, Mallow, Co. Cork, Ireland",52.1086491,-8.7633669
"Scoil na Coróine Mhuire, Ballinahinch, Ashford","Inchanappa South, Ashford, Co. Wicklow, Ireland",53.015562,-6.1062851
"SCOIL PHADRAIG, Canal Road, Portarlington","Claybourne House, Canal Rd, Bracklone, Portarlington, Co. Laois, Ireland",53.1505,-7.1775771
"SCOIL ADHAMHNAIN, Meetinghouse Street, Raphoe","Meetinghouse St, Raphoe Townparks, Raphoe, Co. Donegal, Ireland",54.8715778,-7.6062401
"S N ATH AN MHUILLINN, Kilbolane, Milford",.,.,.
"GLEBE NS, The Glebe, Donegal","The Glebe, Donegal, Ireland",55.0259675,-7.7515049
"KILNABOY N S, kILNABOY,, ENNIS,","Bunnanagat South, Killinaboy, Co. Clare, Ireland",52.9723872,-9.0791749
"SCOIL MHUIRE, PETTIGO, CO DONEGAL","Pettigo, Co. Donegal, Ireland",54.5465038,-7.8383305
"S N EOIN NAOFA, BAILE EASA DARA, CO SLIGEACH","Knockmuldoney, Ballysadare, Co. Sligo, Ireland",54.2121162,-8.5090366
"S N BHEINN NAOFA B, Duleek, Co. Meath","Duleek, Abbeyland, Duleek, Co. Meath, Ireland",53.6468877,-6.4252085
"S N BHEININ NAOFA C, Duleek, Co. Meath","Duleek, Abbeyland, Duleek, Co. Meath, Ireland",53.6468877,-6.4252085
"SN MHUIRE, Ballyhogue, Bree","Ballyhogue Bree, Ballyhoge, Enniscorthy, Co. Wexford, Ireland",52.4141001,-6.5756168
"SCOIL MHUIRE, Brierhill School, Brierhill","Breanloughaun, Castlegar Village, Co. Galway, H91 E5C9, Ireland",53.2943321,-8.9791255
"S N AIBHISTIN NAOFA, Fanaleen, Kilshanny","Kilshanny, Caherlooskaun, Kilshanny, Co. Clare, Ireland",52.982473,-9.298385
"S N MHUIRE, Glenville, Co. Cork","Glenville, Co. Cork, Ireland",52.0459286,-8.4241847
"S N O DUBHLAIN, BALLAGH, KILROOSKEY","Kilroosky, Kilrooskey, Co. Roscommon, Ireland",53.67608,-8.11826
"S N PHADRAIG NAOFA, Kylepark, Borrisokane","Ballyhaden, Borrisokane, Co. Tipperary, Ireland",52.9963736,-8.1273257
"S N PADRAIG NAOFA, St. Patrick's B.N.S., Coote's Lane","Coote's Ln, Deansground, Kilkenny, Ireland",52.6451436,-7.253457
"S N DUN UABHAIR, Donore, Drogheda","Drogheda, Co. Louth, Ireland",53.717856,-6.3560985
"S N AINDREIS NAOFA, Curragha, Ashbourne","Crickstown, Curragha, Co. Meath, A84 DF89, Ireland",53.5373,-6.4437
"S N COILL AN IARAINN, Kilanerin, Gorey","Killinierin, Co. Wexford, Ireland",52.7298638,-6.2824338
"SCOIL IARLATHA NAOFA, Garbally, Ballinasloe","Garbally Park, Mackney, Brackernagh (Clancarty), Ballinasloe, Co. Galway, Ireland",53.3237275,-8.247847
"SCOIL IOGNAID DE RIS, Stephen Street, Kilkenny","Stephens St, Jamesgreen, Kilkenny, Ireland",52.6501441,-7.2601347
"SCOIL FREASTOGAIL MUIRE, College Road, Fermoy","Richmond Hill, Fermoy, Co. Cork, Ireland",52.1344152,-8.2723587
"S N CIARAIN NAOFA, Cloonsh, Kinvara","Durus, Dungory West, Kinvara, Co. Galway, Ireland",53.1391792,-8.9399099
"SCOIL BHREANDAIN NAOFA, CLUAIN FHEARTA, BEAL ATHA NA SLUAIGH","Clonfert, Clonfert North (Seymour), Ballinasloe, Co. Galway, Ireland",53.248848,-8.0369377
"SCOIL CILL CHURNAIN, Kilcornan, Co. Limerick","Kilcornan, Co. Limerick, Ireland",52.6154617,-8.8835047
"ST CONLETHS AND MARYS N S, Newbridge, Co. Kildare","Newbridge, Piercetown, Newbridge, Co. Kildare, Ireland",53.1837999,-6.7918607
"S N CONNLAODH NAOFA N, Naas Road, Newbridge","Naas Rd, Newbridge, Co. Kildare, Ireland",53.1843014,-6.7882125
"GLENCORRIB N S, Ballisnahyny, Shrule","Glencorrib, Ballisnahyny, Shrule, Co. Mayo, Ireland",53.5093818,-9.1691769
"SCOIL MUIRE NAOFA, Menlough, Ballinasloe","Menlough, Pollnabrone, Ballinasloe, Co. Galway, Ireland",53.4104691,-8.5852145
"SCOIL UI CHONAILL BOYS SENIORS, North Richmond Street, Dublin 1","13 Richmond St N, Drumcondra, Dublin, D01 V1K2, Ireland",53.3584422,-6.2502078
"S N AODHA NAOFA, Rahugh, Kilbeggan","Rahugh, Co. Westmeath, Ireland",53.3358278,-7.4378943
"MUIRE NAOFA CASTLECUFFE, CASTLECUFFE NS, CLONASLEE","Scoil Mhuire Naofa, Castlecuffe, Clonaslee, Co. Laois, Ireland",53.1514806,-7.5874137
"S N NAOMH PADRAIG BOYS SENIOR SCHOOL, New Road, Mallow","New Rd, Mallow, Co. Cork, Ireland",52.1390278,-8.6411648
"SCOIL MHUIRE, Tower Road, Chapelizod","99 Ballyfermot Rd, Chapelizod, Dublin 10, D10 CX51, Ireland",53.3428446,-6.3430713
"SANCTA MARIA C B S, Synge Strete, Dublin 8","Synge St, Saint Kevin's, Dublin, Ireland",53.3333658,-6.2671132
"SCOIL CARMEL, Firhouse Road, Dublin 24","Firhouse Rd, Tymon South, Dublin 24, D24 NA44, Ireland",53.2851041,-6.3375154
"CORR NA MADADH N S, Cornamaddy, Athlone","Cornamaddy, Athlone, Co. Westmeath, N37 TR23, Ireland",53.4352903,-7.9025678
"S N BRUSNA, Brosna, Ballaghadereen","Pollboy, Ballaghaderreen, Co. Roscommon, F45 AR29, Ireland",53.916131,-8.6455938
"S N TOBAIR EOIN BAISDE, JOHNSWELL, CO KILKENNY","Johnswell, Johnswell Village, Co. Kilkenny, Ireland",52.70091,-7.17127
"CROSSBRIDGE N S, CROSSBRIDGE, TINAHELY","Tinahely, Co. Wicklow, Ireland",52.8159304,-6.4957772
"COLMCILLE MIXED N S, Bigwood, Mullinavat","Bigwood, Mullinavat, Co. Kilkenny, X91 YA49, Ireland",52.3352727,-7.1150153
"S N EOIN BOSCO BUACH, Navan Road, Dublin 7","Navan Rd, Ashtown, Dublin 7, Ireland",53.3682697,-6.3143542
"S N MHUIRE, Barntown, Co. Wexford","Barntown, Co. Wexford, Ireland",52.3377929,-6.5413891
"ST OLIVER PLUNKETT, Grove Road, Malahide","Grove Rd, Malahide, Co. Dublin, Ireland",53.4464627,-6.1507095
"FREASTOGAIL MHUIRE MXD, Killahan, Abbeydorney","Killahan National School, Ballymacaquim East, Abbeydorney, Co. Kerry, Ireland",52.373036,-9.720097
"AIBHISTIN NAOFA, Clontuskert, Ballinasloe","Ballinasloe, Co. Galway, Ireland",53.3287621,-8.2269467
"DONARD N S, Barrack Street, Donard","Donard, Doodys Bottoms, Donard, Co. Wicklow, Ireland",53.0230701,-6.6153131
"S N MOING NA MIOL, Clashbee, Mallow",.,.,.
"CLOGHANS HILL N S, Cloghan's Hill, Tuam","Tuam Rd, Ballyweela, Tuam, Co. Galway, Ireland",53.5891631,-9.0299209
"S N BEAL AN MHUIRTHEAD, Pearse Street, Belmullet","Belmullet, Co. Mayo, Ireland",54.2238996,-9.9876028
"SN N SAILBHEASTAR NFA, Yellow Walls Road, Malahide","Yellow Walls Rd, Malahide, Co. Dublin, Ireland",53.4507852,-6.1680499
"S N SEACHNAILL NAOFA, Main Street, Dunshaughlin","Seachnaill Pl, Grangend, Co. Meath, Ireland",53.5149104,-6.5394947
"S N BRIGHDE, Ticknevin, Carbury","Ticknevin, Co. Kildare, Ireland",53.3054351,-6.9680475
"ODHRAN NAOFA N S, SONNA, SLANEMORE","Slane More, Mullingar, Co. Westmeath, Ireland",53.5444279,-7.4351324
"SCOIL BHRIDE, AN CNOC BHREAC, BEAL ATHA NA SLUAIGH",.,.,.
"SN EOIN BAISDE BOYS SENIOR SCHOOL, Seafield Road, Clontarf","3 Seafield Rd W, Clontarf, Dublin, D03 HK82, Ireland",53.3636264,-6.196904
"SCOIL MOIN A LIN, Castletroy, Co. Limerick","Castletroy, Limerick, Ireland",52.6585184,-8.5493752
"S N NA MBUACHAILLI, Clonbealy, Newport","Clonbealy, Co. Tipperary, Ireland",52.7150665,-8.3983415
"SCOIL NAOMH CHAITRIONA, College Street, Ballyshannon","College St, Co. Donegal, Ireland",54.5013419,-8.1819195
"SCOIL NAIS NAOMH AINE, Maio, Tierworker","Carnans Lower, Tierworker, Co. Cavan, Ireland",53.88047,-6.92947
"SCOIL NAOMH BRIDE, Batterstown, Trim","Glebe, Batterstown, Co. Meath, Ireland",53.4685215,-6.5357288
"SHANAGARRY N S, SHANAGARRY, MIDLETON","Shanagarry, Shanagarry North, Midleton, Co. Cork, Ireland",51.8546702,-8.0359839
"SCOIL O CURAIN B, Gortboy, Newcastle West","Gortboy, Co. Limerick, Ireland",52.4546634,-9.0502339
"S N NAOMH FHIONAIN, Adamstown, Dunleer","Battsland, Dunleer, Co. Louth, Ireland",53.8310533,-6.3944559
"S N BHAILE EAMONN, Edmondstown Road, Rathfarnham","Edmondstown Rd, Co. Dublin, Ireland",53.2708285,-6.2989713
"SCOIL CAOIMHIN NAOFA, Mount Merrion, Blackrock","Mount Merrion, Stillorgan, Blackrock, Co. Dublin, Ireland",53.291268,-6.2050374
"MUIRE GAN SMAL, CLUAIN DILLEAIN, FERMOY","Cluain Dilleain, Fermoy, Co. Cork, Ireland",52.1377983,-8.2754097
"SCOIL CHOLMCILLE NAOFA, Ballylast, Castlefin","Ballylast, Castlefinn, Co. Donegal, Ireland",54.8031191,-7.5475952
"HOLY FAMILY JUNIOR SCHOOL, Station Road, Ennis","Holy Family Jr School, Station Rd, Clonroad Beg, Ennis, Co. Clare, Ireland",52.8425088,-8.9811395
"S N LUSCA, Chapel Road, Lusk","Chapel Rd, Lough Common, Lusk, Co. Dublin, Ireland",53.5289113,-6.1684511
"S N MHUIRE NAOFA, Rathfeigh, Tara","Rathfeigh, Co. Meath, Ireland",53.5933701,-6.4861782
"S N BHRIDE, ARD ACHAIDH, OMEATH","Knocknagoran, Omeath, Co. Louth, Ireland",54.0882604,-6.2593365
"S N MULLACH RUA, Mullaghroe, Gurteen","Mullaghroe, Co. Sligo, Ireland",53.9837436,-8.4647123
"URSAILLE NAOFA, Stephenstown South, Two Mile House","Stephenstown South, Co. Kildare, Ireland",53.1653621,-6.7028522
"S N MHUIRE, Abbey Road, Navan","Abbeyland South, Navan, Co. Meath, Ireland",53.6548102,-6.6920265
"OUR LADY OF MERCY CONVENT SCHOOL, Rosemount Terrace, Booterstown","Rosemount Terrace, Booterstown Ave, Williamstown, Blackrock, Co. Dublin, Ireland",53.3053299,-6.2002401
"S N CILL MHUIRE B, Lisardagh, Co. Cork","Cloghmacow, Kilmurry, Co. Cork, Ireland",51.8416212,-8.8818965
"SCOIL ASSAIM BOYS SENIORS, Raheny, Dublin 5","All Saints Dr, Clontarf East, Raheny, Co. Dublin, Ireland",53.3788386,-6.1767458
"SCOIL AINE CONVENT SENIOR, All Saints Drive, Raheny","5 All Saints Rd, Clontarf East, Dublin 5, D05 C960, Ireland",53.3777244,-6.1782559
"NAISCOIL IDE, All Saints Drive, Raheny","All Saints' Drive, Raheny, Dublin 5, Ireland",53.378305,-6.1772504
"S N CNOC AINBHIL, Lower Kilmacud Road, Stillorgan","Lower Kilmacud Rd, Stillorgan, Dublin, Ireland",53.2889518,-6.2052505
"SCOIL MHUIRE, Ardeevin, Williamstown",.,.,.
"S N GLEANN NA GCREABHAR, GLEANN NA GCREABHAR, CILL MOCHEALLOG","Anglesborough, Co. Limerick, Ireland",52.3403057,-8.2895418
"S N NMH SHEOSAMH, Boyerstown, Navan","N.S, Boyerstown, Navan, Co. Meath, C15 WT26, Ireland",53.6344699,-6.7513358
"S N DROM CNAMH, Drumcrave, Co. Cavan","Drumcrauve, Dromcrave, Co. Cavan, Ireland",53.9970973,-7.3358672
"EOIN NAOFA N S, High Street, Ballymore","High Street, Ballymore, Mullingar, Co. Westmeath, Ireland",53.4908301,-7.6787706
"SCOIL MHUIRE GAN SMAL B, School Avenue, Glasheen Road","School Ave, Glasheen, Cork, Ireland",51.886577,-8.498986
"S N FHOIRTCHEIRN/FHININ, Myshall, Bagenalstown","Myshall, Co. Carlow, Ireland",52.6858791,-6.7804051
"S N OILIBHEAR PLUNGLEAD, Killina, Carbury","Carbury, Co. Kildare, Ireland",53.3059216,-6.916011
"GLEN NA SMOL N S, Glenasmole, Bohernabreena","Glenasmole National School, Bohernabreena, Glenasmole, Co. Dublin, Ireland",53.2454668,-6.3576035
"ST MARYS N S GRANGE, Ballybrusa, Grange",.,.,.
"Scoil Mhuire Naofa, Carrigtwohill, Co. Cork","36 Elsinore Rise, Broomfield West, Midleton, Co. Cork, P25 X431, Ireland",51.9091358,-8.2634066
"S N NAOMH LORCAN, OMEATH, DUNDALK","Shore Rd, Knocknagoran, Omeath, Co. Louth, Ireland",54.0824012,-6.252256
"DRUMGALLAGH N S, Ballycroy, Westport","Ballycroy National Park, Tarsaghaun More, Westport, Co. Mayo, Ireland",54.0686046,-9.6863565
"S N ATHRACHT NFA, Charlestown, Co. Mayo","Lavy Beg, Charlestown, Co. Mayo, Ireland",53.9640248,-8.7926035
"SCOIL MHUIRE GAN SMAL, Feevagh, Dysart","Feevagh, Ballinasloe, Co. Roscommon, Ireland",53.431103,-8.2257303
"S N OLIBHEAR PLUINCEID, Rann na Feirsde, Anagaire","Ranafast, Co. Donegal, Ireland",55.034738,-8.3063621
"Davidstown Primary School, Davidstown Primary School, Enniscorthy","Davidstown, Ballygillistown, Enniscorthy, Co. Wexford, Ireland",52.480053,-6.6370807
"S N CRUACHAIN, Carrowmore, Croghan","Killappoge, Croghan, Co. Roscommon, Ireland",53.9115865,-8.2207157
"Scoil an Chroi Ro Naofa, The Swan, via Athy","Athy, Co. Kildare, Ireland",52.9918336,-6.9857281
"S N COLUMBAIN, Mullingar Road, Ballivor","Ballivor, Kilballivor, Ballivor, Co. Meath, Ireland",53.5336581,-6.9721792
"SCOIL BHRIDE N S, Rathangan, Co. Kildare","Rathangan, Newtown, Rathangan, Co. Kildare, Ireland",53.2231173,-6.9894626
"S N CHAOIMHIN NAOFA, Philipstown, Dunleer","Philipstown, Dunleer, Co. Louth, Ireland",53.8315201,-6.3949099
"S N AN GHARRAIN, Gurranes, Innishannon","Gurranes National School, Innishannon, Co. Cork, Ireland",51.8323075,-8.6566136
"SN AN CROI RO NAOFA, Belclare, Tuam","Belclare National School, Common, Tuam, Co. Galway, Ireland",53.4925764,-8.9386798
"Aughnafarcon National School, Aughnafarcon, Broomfield","Aughnafarcon, Broomfield, Co. Monaghan, A75 Y934, Ireland",54.0651857,-6.7479926
"SCOIL MUIRE GAN SMAL, Ardattin, Co. Carlow","Ardattin, Carlow, Ireland",52.7550249,-6.706149
"CLOONIQUIN N S, Clooneyquinn, Elphin","Killynagh More, Castlerea, Co. Roscommon, Ireland",53.8056725,-8.2306636
"CORR A CHRAINN NATIONAL SCHOOL, Corracrin, Emyvale","Corracrin, Emyvale, Co. Monaghan, H18 XH29, Ireland",54.3170615,-6.963329
"S N MUIRE GAN SMAL, DRUIMEANNA, TUBBERCURRY","Druimeanna, Carrigeenagowna, Tubbercurry, Co. Sligo, Ireland",54.0546051,-8.7754609
"SCOIL AILBHE, Caherelly, Grange","Caherelly National School, Caherelly East, Kilmallock, Co. Limerick, Ireland",52.550684,-8.5007743
"S N BRIDE, Suncroft, Curragh","Curragh, Co. Kildare, Ireland",53.1420265,-6.8285954
"S N CLUAIN MUINGE, Clonmoney, Newmarket-on-Fergus","Clonmoney, Newmarket-on-Fergus, Co. Clare, Ireland",52.760601,-8.8946896
"KILCOMMON N S, Kilcommon, Churchlands","Kilcommon, Churchland, Tinahely, Co. Wicklow, Ireland",52.7935019,-6.4588877
"S N MHUIRE, Muchgrange, Greenore","Muchgrange, Dundalk, Co. Louth, Ireland",54.0122473,-6.1385643
"DIARMADA N S, Castlepollard, Co. Westmeath","Castlepollard, Townparks, Castlepollard, Co. Westmeath, Ireland",53.6800722,-7.2964508
"S N MHUIRE, Heronstown, Lobinstown","Heronstown, Lobinstown, Co. Meath, Ireland",53.7791226,-6.6253755
"ST MARGARETS N S, Sandyhill, Saint Margaret's","St Margaret's, Sandyhill, St Margarets, Co. Dublin, Ireland",53.4303622,-6.3004876
"NA MINTEOGA N S, Meentogues, Headford","Meentoges, Co. Kerry, Ireland",52.0915303,-9.3176891
"S N NAOMH PADRAIG, Collon Road, Slane","Collon Rd, Hill of Rath, Co. Louth, Ireland",53.7420008,-6.4202814
"S N MUIRE GAN SMAL, Tiernascragh, Ballycrissane","Ballycrissane, Ashfield, Ballinasloe, Co. Galway, Ireland",53.1508865,-8.191925
"S N NAOMH PADRAIG, Cockhill Road, Stamullen","Cock Hill Rd, Co. Meath, Ireland",53.6404785,-6.273846
"S N MUIRE GAN SMAL, Cartown, Termonfeckin","Sandpit, Newhouse, Drogheda, Co. Louth, Ireland",53.7701294,-6.3095821
"SCOIL BRIDE B, Church Avenue, Blanchardstown","15 Church Ave, Blanchardstown, Dublin, D15 E9CX, Ireland",53.3844633,-6.3763638
"SCOIL BRIDE C, Church Avenue, Blanchardstown","15 Church Ave, Blanchardstown, Dublin, D15 E9CX, Ireland",53.3844633,-6.3763638
"S N NAOMH DEAGLAN, College Road, Ardmore","Duffcarrick, Ardmore, Co. Waterford, Ireland",51.9510741,-7.725329
"MUIRE NA MAINISTREACH, New Road, Killarney","New Rd, Inch, Killarney, Co. Kerry, Ireland",52.0622646,-9.5170837
"COOLE N.S,, GARRADICE,, KILCOCK,","Coole National School, Garadice, Kilcock, Co. Meath, Ireland",53.4523042,-6.7273508
"S N MUIRE GAN SMAL, Sentry Hill, Letterkenny","103 Sentry Hill Rd, Letterkenny, Co. Donegal, F92 KVC0, Ireland",54.9523511,-7.7401751
"SOOEY N S, Sooey, Boyle","Sooey National School, Srananagh, Sooey, Co. Sligo, Ireland",54.1663859,-8.3946075
"HOLLYWOOD N S, Hollywood Village, Hollywood","R756, Hollywood Upper, Hollywood, Co. Wicklow, W91 N260, Ireland",53.0915022,-6.5994471
"S N MHUIRE, Ballymore Eustace, Naas","Naas Rd, Kimmeens, Ballymore Eustace, Co. Kildare, W91 PF86, Ireland",53.1345526,-6.6164576
"SCOIL MHUIRE, Kilcruttin, Tullamore","Kilcruttin, Tullamore, Co. Offaly, R35 K250, Ireland",53.271717,-7.4999389
"SCOIL NAOMH SEOSAMH, Rathdonnell, Letterkenny","Letterkenny, Co. Donegal, Ireland",54.9558392,-7.7342787
"BAILIEBORO N S, Tanderagee, Bailieborough","Bailieborough, Beckscourt, Bailieborough, Co. Cavan, Ireland",53.9171451,-6.9739934
"SCOIL MHUIRE, Ballyleague, Lanesborough","Lanesborough, Co. Longford, Ireland",53.6714035,-7.9873346
"S N AN GRAINSEACH, Clonmel, Co. Tipperary","Clonmel, Co. Tipperary, Ireland",52.3558172,-7.6902551
"S N NAOMH LORCAIN, Levitstown, Maganey","Levitstown, Maganey, Athy, Co. Kildare, Knockroe, Co. Kildare, Ireland",52.9106812,-6.9140447
"S N MUIRE, Gowran, Co. Kilkenny","Gowran, Co. Kilkenny, Ireland",52.6293634,-7.0650083
"S N PEADAR AGUS POL, ATH AN URCHAIR, MOATE","Cartronkeel, Moate, Co. Westmeath, Ireland",53.3949987,-7.7186188
"NAOMH SEOSAMH, Mell, Drogheda","Mell, Drogheda, Co. Louth, Ireland",53.7178982,-6.3670644
"Scoil Mhuire gan Smál, Claremount, Claremorris","Scoil Mhuire Gan Smal, Claremount, Claremorris, Co. Mayo, Ireland",53.7296919,-9.0029163
"RATHDOMHNAIGH N S, CHURCH STREET, RATHDOWNEY","Rathdowney, Co. Laois, Ireland",52.8557157,-7.5867228
"SCOIL NÁISIÚNTA MUIRE GAN SMÁL, Townparks, Lifford","Townparks, Lifford, Co. Donegal, Ireland",54.8315991,-7.4940892
"S N CNOC MACHAN, Knockmahon, Bunmahon","Knockmahon, Bunmahon, Co. Waterford, Ireland",52.1405503,-7.365204
"SCOIL BHRIDE B7C, Paulstown, Kilkenny","Paulstown, Jordanstown, Paulstown, Co. Kilkenny, Ireland",52.6821382,-7.0237358
"SCOIL MHUIRE MXD, Tuckett's Lane, Howth","2 Tuckett's Ln, Howth, Dublin, D13 H688, Ireland",53.384338,-6.0677421
"S N DUMHACH, Dooagh, Achill","Slievemore, Dooagh, Co. Mayo, Ireland",53.9749643,-10.1266688
"SCOIL MHUIRE GAN SMAL, Ballinageragh, Lixnaw","4 The Cottages, Monument, Lixnaw, Co. Kerry, V92 F7D8, Ireland",52.4056393,-9.6173716
"BALLYNEALE N S, Ballyneale, Carrick-on-Suir","Ballyneale National School, Ballyneale, Carrick-On-Suir, Co. Tipperary, Ireland",52.3743324,-7.4662286
"DUNFANAGHY N S, Hornhead Rd, Dunfanaghy","Hornhead Rd, Dunfanaghy, Co. Donegal, Ireland",55.1830697,-7.9772635
"S N ODHRAN NAOFA, Ballinaclough, Nenagh","Ballinaclough, Nenagh, Co. Tipperary, Ireland",52.8246346,-8.1619139
"SCOIL NAOMH MHUIRE, Maree, Oranmore","Lisheenkyle National School, Lisheenkyle West, Oranmore, Co. Galway, Ireland",53.2920595,-8.8445967
"S N CILL DAMHAIN, Kildavin, Co. Carlow","Kildavin, Co. Carlow, Ireland",52.683205,-6.6849832
"S N BAILE MHIC ADAIM, BAILE MHIC ADAIM, MAGH BHEALAIGH","Clonagh, Cadamstown, Co. Kildare, Ireland",53.3999787,-6.9202213
"S N CLOCH RINNCE, Broadford, Co. Kildare","Clogherinkoe, Claremount, Clogharinka, Co. Kildare, Ireland",53.397737,-7.015285
"S N DUN NA MAINISTREACH, Sheares Street, Abbeyside","Sheares St, Abbeyside, Dungarvan, Co. Waterford, Ireland",52.0905343,-7.6122558
"S N COILL DUBH, Coill Dubh, Naas","122, Coill Dubh, Co. Kildare, W91 A2PT, Ireland",53.2939248,-6.8208099
"TOGALA MHUIRE, Kiltullagh, Co. Galway","Clogharevaun, Kiltullagh, Co. Galway, Ireland",53.2747335,-8.6369624
"S N MUIRE NA TROCAIRE, Hale Street, Ardee","Hale St, Dawsonsdemesne, Ardee, Co. Louth, Ireland",53.8528973,-6.5337358
"S N MUIRE, Rampark, Jenkinstown","Rampark Grove, Rampark, Jenkinstown, Co. Louth, Ireland",54.0027174,-6.2618269
"S N NA TRIONOIDE NAOFA, Lismullen, Garlow Cross","Lismullin, Co. Meath, Ireland",53.5965499,-6.5904989
"WHITECHURCH N S CEAPACH, Clonkerdon, Cappagh","Cappagh, Co. Waterford, Ireland",52.1029085,-7.7782137
"S N INIS CEALTRACH, Mountshannon, Co. Clare","Mountshannon, Co. Clare, Ireland",52.932767,-8.4416822
"S N GORT NA GAOITHE, GORT NA GAOITHE, Newbridge","Gort, Co. Galway, Ireland",53.0666432,-8.8187485
"SCOIL NAOMH EANNA, BULLAUN, LOUGHREA","Gortcam, Bullaun, Co. Galway, H62 EY13, Ireland",53.249194,-8.5543429
"S N CILL SOLAIN, Killasolan, Caltra","Caltrapallas, Caltra, Co. Galway, Ireland",53.4352939,-8.4355564
"S N NAOMH EIGHNEACH, DISEART EIGHNIGH, BUNCRANNACH","Green St, Dingle, Co. Kerry, Ireland",52.1418479,-10.270519
"S N MHUIRE, Cloneygowan, Tullamore","Cloneygowan, Clonygowan, Tullamore, Co. Offaly, Ireland",53.1897926,-7.2848115
"Cloontuskert National School, Lanesboro, Co. Longford","Cloontuskert, Co. Roscommon, Ireland",53.7002991,-8.0126393
"COOLFANCY N S, CUL FHASAIGH, TINAHELY","Coolfancy, Ballinacor, Tinahely, Co. Wicklow, Ireland",52.7994194,-6.46454
"SCOIL MHUIRE, CAISEAL, CEANNDROMA O.P.","P.O., Fanad,, Cashel, Co. Donegal, Ireland",55.2300158,-7.7230829
"S N MHUIRE, Carna, Co. na Gaillimhe","Scoil Mhuire Carna, Carna, Co. Galway, Ireland",53.3230751,-9.8162934
"SCOIL NAOMH MHUIRE, Mountbellew, Ballinasloe","Treanrevagh, Mountbellew, Co. Galway, Ireland",53.47188,-8.5049
"S N SAN NIOCLAS, TIGH BANAN, CASTLEBELLINGHAM","Castlebellingham, Co. Louth, Ireland",53.8978634,-6.3894299
